SCHOOL,PROGRAM,DEGREE,ONLINE,ONCAMPUS,COUNTRY,STATE,CITY,DEPARTMENT,URL
Nebraska College of Technical Agriculture,Business Analytics Graduate Certificate,C,F,T,US,NE,Curtis,College of Business Administration,http://news.unl.edu/newsrooms/unltoday/article/cba-to-offer-business-analytics-program/
University of Nebraska at Omaha,Data Science Concentration,B,F,T,US,NE,Omaha,Mathematics,http://www.unomaha.edu/college-of-arts-and-sciences/mathematics/academics/undergraduate.php#data
University of Nebraska at Omaha,Data Science Concentration,M,F,T,US,NE,Omaha,Mathematics,http://www.unomaha.edu/college-of-arts-and-sciences/mathematics/community-engagement/data-science.php
Southern New Hampshire University,Master of Science in Data Analytics,M,T,F,US,NH,Manchester,Graduate,http://www.snhu.edu/online-degrees/graduate-degrees/data-analytics-ms-online/careers.asp
Southern New Hampshire University,MS in Information Technology - Healthcare Informatics,M,T,F,US,NH,Manchester,School for Professional Studies,http://www.snhu.edu/online-degrees/graduate-degrees/information-technology-MS-online/health-Informatics.asp
Southern New Hampshire University,MBA in Business Intelligence,M,T,F,US,NH,Manchester,,http://www.snhu.edu/online-degrees/graduate-degrees/MBA-online/business-intelligence-curriculum.asp
Southern New Hampshire University,Data Analytics,B,T,F,US,NH,Manchester,,http://www.snhu.edu/online-degrees/undergraduate-degrees/data-analytics-bs-online.asp
University of New Hampshire,Analytics & Data Science,B,F,T,US,NH,Durham,Applied Engineering & Sciences,https://manchester.unh.edu/academics/degree-programs/analytics
University of New Hampshire,Analytics & Data Science,M,F,T,US,NH,Durham,Graduate School,https://www.unh.edu/analytics
University of New Hampshire,Analytics,C,F,T,US,NH,Durham,Graduate School,https://gradschool.unh.edu/analytics/program/certificate/analytics
University of New Hampshire,Data Science,C,T,F,US,NH,Durham,Graduate School,https://gradschool.unh.edu/analytics/program/certificate/data-science
Sollers College,MS in Data Science,M,F,T,US,NJ,Edison,,https://www.sollers.edu/information-technology/master-of-science-in-data-science/
Drew University,MS in Data Analytics,M,F,T,US,NJ,Madison,,https://www.drew.edu/caspersen/data-analytics/
New Jersey Institute of Technology,MS in Applied Statistics,M,T,F,US,NJ,Newark,Department of Mathematical Sciences,http://math.njit.edu/academics/graduate/ms-appliedstatistics/index.php
New Jersey Institute of Technology,Graduate Certificate in Data Mining,C,T,F,US,NJ,Newark,Department of Computer Science,http://online.njit.edu/programs/certs/datamining-cert.php
Rutgers University,Online Master of Information,M,T,F,US,NJ,Camden,School of Communication and Information,http://online.rutgers.edu/master-library-info/
Rutgers University,Master of Business And Science Degree in Analytics - Discovery Informatics & Data Sciences,M,F,T,US,NJ,Camden,Division of Continuous Education and Outreach,http://psm.rutgers.edu/programs/analytics-data-sciences
Rutgers University,Post MBA Certificate in Analytics and Information Management,C,F,T,US,NJ,Camden,Rutgers Business School,http://www.business.rutgers.edu/mba/admissions/post-mba-certificate
Rutgers University,MBA with Analytics and Information Management Concentration,M,F,T,US,NJ,Camden,Rutgers Business School,http://www.business.rutgers.edu/mba/concentrations/aim
Saint Peter's University,Master of Science in Data Science with a concentration in Business Analytics,M,T,F,US,NJ,Jersey City,Saint Peter's University,http://www.saintpeters.edu/data-science-and-business-analytics/
Stevens Institute of Technology,MS in Business Intelligence and Analytics,M,T,F,US,NJ,Hoboken,Graduate School,http://www.stevens.edu/sit/graduate/master-of-science-business-intelligence-and-analytics.cfm
Stevens Institute of Technology,BI&A Graduate Certificate,C,F,T,US,NJ,Hoboken,Wesley J. Howe School of Technology Management,https://www.stevens.edu/howe/academics/graduate/business-intelligence-analytics-bi-ms/bi-graduate-certificate
Stevens Institute of Technology,Master of Science in Information Systems,M,T,F,US,NJ,Hoboken,Wesley J. Howe School of Technology Management,https://www.stevens.edu/howe/academics/graduate/information-systems
Thomas Edison State University,MBA in Data Analytics,M,F,T,US,NJ,Trenton,School of Business & Management,http://www.tesu.edu/business/mba/Data-Analytics.cfm
Thomas Edison State University,Data Science and Analytics,B,F,T,US,NJ,Trenton,Heavin School of Arts & Sciences,http://www.tesu.edu/heavin/bs/Data-Science.cfm
University of Nevada-Reno,Information Systems Data Analytics Track,M,F,T,US,NV,Reno,,http://www.unr.edu/business/degree-programs/information-systems/msis#dataanalyticstrack
City College-City University of New York,Masters in Data Science and Engineering (MS-DSE),M,F,T,US,NY,New York City,Grove School of Engineering-Computer Science,https://www.ccny.cuny.edu/dse
Columbia University in the City of New York,Master of Science in Data Science,M,F,T,US,NY,New York,Data Science Institute,http://datascience.columbia.edu/master-of-science-in-data-science
Columbia University in the City of New York,Master of Arts in Statistics,M,F,T,US,NY,New York,Department of Statistics,http://stat.columbia.edu/ma-programs/
Columbia University in the City of New York,Master of Science in Computer Science with concentration in Machine Learning,M,T,T,US,NY,New York,Fu Foundation School of Engineering and Applied Science,http://www.cs.columbia.edu/education/ms/machineLearning/
Columbia University in the City of New York,Master of Arts in Biomedical Informatics,M,F,T,US,NY,New York,"Department of Biomedical Informatics, Columbia University Medical Center",https://www.dbmi.columbia.edu/prospective-students/our-programs/ma/
Columbia University in the City of New York,PhD in Biomedical Informatics,M,F,T,US,NY,New York,"Department of Biomedical Informatics, Columbia University Medical Center",https://www.dbmi.columbia.edu/prospective-students/our-programs/phd/
Columbia University in the City of New York,PhD in Statistics,D,F,T,US,NY,New York,"Department of Statistics,Graduate School of Arts and Sciences",http://stat.columbia.edu/programs/ph-d-program/
Columbia University in the City of New York,Master of Science in Applied Analytics,M,F,T,US,NY,New York,School of Professional Studies,http://sps.columbia.edu/applied-analytics/master-of-science-in-applied-analytics
Columbia University in the City of New York,Masters in Applied Statistics,M,F,T,US,NY,New York,"Division on Measurement, Evaluation and Statistics, Department of Human Development, Columbia University Teachers College",http://www.tc.columbia.edu/human-development/measurement-evaluation-and-statistics/degrees/
Columbia University in the City of New York,Master of Arts in Quantitative Methods for Social Sciences,M,F,T,US,NY,New York,"Institute for Social and Economic Research and Policy (ISERP), Columbia University",http://www.qmss.columbia.edu/
Columbia University in the City of New York,Master of Science in Data Journalism,M,F,T,US,NY,New York,Columbia Journalism School,https://journalism.columbia.edu/ms-data-journalism
Cornell University,Master of Science in Health Informatics,M,F,T,US,NY,Ithaca,Cornell Medial College,http://hpr.weill.cornell.edu/education_and_training/MS_Health_Informatics_curriculum.html
Cornell University,Master of Professional Studies (MPS) in Applied Statistics (Option II: Data Science),M,F,T,US,NY,Ithaca,Department of Statistical Science,http://stat.cornell.edu/academics/mps
Cornell University,Data Analytics,M,F,T,US,NY,Ithaca,Engineering,http://www.orie.cornell.edu/orie/academics/master/index.cfm
Cornell University,MBA,M,F,T,US,NY,Ithaca,Johnson School of Management,https://www.johnson.cornell.edu/Programs/Full-Time-MBA/Two-Year-MBA
CUNY Bernard M Baruch College,Advanced Certificate in Business Analytics of Large-Scale Data,C,F,T,US,NY,New York,School of Business,http://www.csi.cuny.edu/catalog/graduate/advanced-certificate-in-business-analytics-of-large-scale-data.htm
CUNY Graduate School and University Center,Online Master of Science in Data Analytics,M,F,T,US,NY,New York,CUNY School of Professional Studies,https://sps.cuny.edu/academics/graduate/master-science-data-analytics-ms
CUNY Queens College,MA in Data Analytics & Applied Social Research,M,T,F,US,NY,Flushing,Sociology Department,http://qcbigdata.com/program/
DeVry University,Big Data and Analytics,B,T,T,US,NY,New York City,,https://www.devry.edu/degree-programs/engineering-information-sciences/big-data-and-analytics-degree-specialization.html
Fordham University,Master of Science in Business Analytics,M,F,T,US,NY,Bronx,Graduate School of Business,http://www.bnet.fordham.edu/academic_bulletin/2015/ms/MS_Business_Analytics/index.asp
Keller Graduate School of Management,MBA with a Business Intelligence and Analytics Management Concentration,M,F,T,US,NY,New York,Keller Graduate School of Management,http://keller.edu/graduate-degree-programs/mba-program/business-intelligence-mba.html
Marist College,Advanced Certificate in Business Analytics,C,T,F,US,NY,Poughkeepsie,School of Computer Science and Mathematics,http://www.marist.edu/admission/graduate/business-analytics/
New York University,PhD in Data Science,D,T,F,US,NY,New York,NYU Center for Data Science,http://cds.nyu.edu/phd-program/
New York University,Master of Science in Data Science,M,T,F,US,NY,New York,NYU Center for Data Science,http://cds.nyu.edu/academics/ms-in-data-science/
New York University,Advanced Certificate in Applied Urban Science and Informatics,C,F,T,US,NY,New York,Center for Urban Science & Progress,http://cusp.nyu.edu/advanced-certificate-in-applied-urban-science-and-informatics/
New York University,MS in Applied Urban Science and Informatics,M,T,T,US,NY,New York,Center for Urban Science & Progress,http://cusp.nyu.edu/ms-in-applied-urban-science-and-informatics/
New York University,Master of Science in Applied Statistics for Social Science Research,M,T,F,US,NY,New York,"Steinhardt School of Culture, Education, and Human Development: D",http://steinhardt.nyu.edu/graduate_admissions/guide/assr/ms
New York University,Certificate in Healthcare Informatics,C,T,F,US,NY,New York,School of Professional Studies: Management and Information Technology,http://www.scps.nyu.edu/academics/departments/information-technology/academic-offerings/noncredit/certificate-in-healthcare-informatics.html
New York University,"MBA, Specialization in Business Analytics",M,T,F,US,NY,New York,Stern School of Business,http://www.stern.nyu.edu/programs-admissions/full-time-mba/academics/specializations/business-analytics/index.htm
New York University,Master of Science in Business Analytics,M,T,F,US,NY,New York,Stern School of Business,http://www.stern.nyu.edu/programs-admissions/global-degrees/business-analytics/academics/course-index/
New York University,Master of Science in Information Systems,M,F,T,US,NY,New York,Computer Science Department,https://cs.nyu.edu/webapps/content/academic/graduate/msis
New York University,Applied Data Analytics and Visualization,B,F,T,US,NY,New York,School of Professional Studies,http://www.sps.nyu.edu/academics/departments/mcghee/undergraduate/bs-applied-data-analytics-and-visualization.html
Pace University-New York,MS in Customer Intelligence and Analytics,M,T,F,US,NY,New York,Lubin School of Business,http://www.pace.edu/lubin/ms-in-customer-intelligence-analytics
Pace University-New York,Master of Science in Information Systems,M,T,F,US,NY,New York,Seidenberg School of Computer Science and Information Systems,http://www.pace.edu/seidenberg/ms-in-information-systems
Rensselaer Polytechnic Institute,MS in Business Analytics,M,F,T,US,NY,Troy,Lally School of Management,http://lallyschool.rpi.edu/academics/ms_ba.html
Rensselaer Polytechnic Institute,M.S. in Information Technology - Concentration in Data Science and Analytics,M,F,T,US,NY,Troy,Department of Information Technology & Web Science,https://www.rpi.edu/dept/IT/graduate/Masters.html
St. John's University-New York,Master of Science in Data Mining and Predictive Analytics,M,F,T,US,NY,Queens,"Department of Computer Science, Mathematics, and Science",http://www.stjohns.edu/academics/schools-and-colleges/college-professional-studies/programs-and-majors/data-mining-and-predictive-analytics-master-science
Syracuse University,Data Science,M,T,F,US,NY,Syracuse,,https://datascience.syr.edu/
Syracuse University,Certificate of Advanced Study in Data Science,C,T,F,US,NY,Syracuse,School of Information Studies,http://ischool.syr.edu/future/cas/datascience.aspx
The New School,Data Visualization (MS),M,T,F,US,NY,New York,"School of Art, Media & Technology",http://www.newschool.edu/parsons/ms-data-visualization/
Trocaire College,Certificate in Healthcare Informatics,C,T,F,US,NY,Buffalo,Healthcare Informatics,https://www.trocaire.edu/academics/healthcare-informatics/healthcare-informatics-certificate
Union Graduate College,Master of Science in Healthcare Data Analytics,M,T,F,US,NY,Schenectady,School of Management,http://www.uniongraduatecollege.edu/management/MS-Healthcare.aspx
Fei Tian College,Bachelor of Science (BS) in Data Science,B,F,T,US,NY,Middletown,Data Science,https://www.mt.feitian.edu/data-science
University at Buffalo,Master of Science (MS) in Management Science: Business Analytics and Systems from the State University of New York at Buffalo and a Master of Business,M,T,F,US,NY,Buffalo,University at Buffalo School of Management and Amrita University,http://mgt.buffalo.edu/faculty/academic/systems/business-analytics-amrita
University of Rochester,Professional MS in Computer Science (Concentration in Data Analytics),M,F,T,US,NY,Rochester,Department of Computer Science,http://www.cs.rochester.edu/graduate/masters-program.html
University of Rochester,Data Science,B,F,T,US,NY,Rochester,Interdisciplinary,http://www.rochester.edu/data-science/academics/index.html
University of Rochester,Master of Science in Data Science,M,F,T,US,NY,Rochester,Institute for Data Science,http://www.rochester.edu/data-science/degrees/MSdetails.html
University of Rochester,MS in Business Administration (Concentration in Business Analytics),M,F,T,US,NY,Rochester,Simon School of Business,http://www.simon.rochester.edu/programs/full-time-ms/academics/programs/business-analytics/index.aspx
University of Rochester,MA and MS in Medical Statistics,M,F,T,US,NY,Rochester,Department of Biostatistics and Computational Biology,http://www.urmc.rochester.edu/education/graduate/phd/statistics/
Bowling Green State University,Master of Science in Applied Statistics (specialization in Business Analytics),M,F,T,US,OH,Bowling Green,Department of Applied Statistics & Operations Research/Department of Mathem,http://www.bgsu.edu/business/asor/graduateprograms.html
Bowling Green State University,M.S. in Analytics,M,F,T,US,OH,Bowling Green,Graduate College,http://www.bgsu.edu/graduate/analytics.html
Case Western Reserve University,Systems Biology and Informatics,D,F,T,US,OH,Cleveland,Molecular and Computational Biology,http://bioinformatics.case.edu/
Case Western Reserve University,Health Informatics,M,F,T,US,OH,Cleveland,Case School of Engineering,http://engineering.case.edu/eecs/node/466
Case Western Reserve University,Data Science,B,F,T,US,OH,Cleveland,Data Science,http://datascience.case.edu/
Cleveland State University,Graduate Certificate in Strategic Business Analytics,C,T,F,US,OH,Cleveland,Monte Ahuja College of Business,http://www.csuohio.edu/business/academics/business-analytics-graduate-certificate-programs
Cleveland State University,Graduate Certificate in Advanced Business Analytics,C,T,F,US,OH,Cleveland,Monte Ahuja College of Business,http://www.csuohio.edu/business/academics/business-analytics-graduate-certificate-programs
Denison University,Major in Data Analytics,B,F,T,US,OH,Granville,Data Analytics,http://denison.edu/academics/data-analytics
Miami University of Ohio,Business Analytics Minor,B,F,T,US,OH,Oxford,Business,http://miamioh.edu/academics/majors-minors/minors/business-analytics.html
Miami University of Ohio,I.S. and Analytics,B,F,T,US,OH,Oxford,Business,http://miamioh.edu/fsb/academics/isa/academics/majors/co-major/index.html
Notre Dame College,Certificate in Competitive Business Intelligence,C,F,T,US,OH,Cleveland,Notre Dame College Online,http://online.notredamecollege.edu/programs/certificate-in-competitive-business-intelligence/
Ohio University,Online MBA in Business Analytics,M,T,F,US,OH,Athens,College of Business,http://onlinemasters.ohio.edu/masters-business-administration/
The Ohio State University,Master of Public Health in Biomedical Informatics,M,T,F,US,OH,Columbus,College of Medicine,http://medicine.osu.edu/bmi/education/prospective_students/ms-and-mph-degrees/pages/index.aspx
The Ohio State University,Master of Applied Statistics,M,F,T,US,OH,Columbus,Department of Statistics,http://www.stat.osu.edu/dept/descriptions-programs/master-applied-statistics/quarters
The Ohio State University,Data Analytics,B,F,T,US,OH,Columbus,Interdisciplinary,https://data-analytics.osu.edu/
University of Akron,Data Science,M,F,T,US,OH,Akron,Center for Data Science Analytics and Information Technology,http://uakron.edu/datascience/
University of Cincinnati-Main Campus,Master of Science in Health Informatics,M,T,T,US,OH,Cincinnati,College of Allied Health Sciences,http://mshi.uc.edu/
University of Cincinnati-Main Campus,Master of Science in Business Analytics,M,F,T,US,OH,Cincinnati,Lindner College of Business,https://business.uc.edu/programs/graduate/msbana.html
Oklahoma State University Center for Health Sciences,Graduate Certificate in Business Data Mining,C,F,T,US,OK,Tulsa,Watson Graduate School of Management,http://watson.okstate.edu/datamining/program/
Oklahoma State University Center for Health Sciences,Graduate Certificate in Marketing Analytics,C,T,F,US,OK,Tulsa,Watson Graduate School of Management,http://watson.okstate.edu/marketinganalytics/program/
Southwestern Oklahoma State University,M.S. Healthcare Informatics & Information Management,M,T,F,US,OK,Weatherford,Allied Health,http://www.swosu.edu/academics/him/programs/graduate/curriculum.aspx
University of Oklahoma Norman Campus,Data Science,M,F,T,US,OK,Norman,College of Engineering,http://www.ou.edu/coe/datascience.html
University of Oklahoma Norman Campus,MS in Management Information Systems,M,F,T,US,OK,Norman,Division of Management Information Systems,http://www.ou.edu/price/mis/mis_ms_in_mis.html
Oregon State University,MBA in Business Analytics,M,F,T,US,OR,Corvallis,College of Business,http://business.oregonstate.edu/mba/academics/tracks/business-analytics
Pacific University,Bachelors of Science in Data Science,B,F,T,US,OR,Forest Grove,Mathematics and Computer Science,http://www.pacificu.edu/data-science 
Juniata College,Data Science,B,F,T,US,PA,Huntingdon,,https://www.juniata.edu/academics/departments/data-science/
Juniata College,Masters of Data Science,M,T,F,US,PA,Huntingdon,,https://www.juniata.edu/academics/graduate-programs/data-science.php
Albright College,M.S. in Business Intelligence,M,F,T,US,PA,Reading,Erivan K. Haub School of Business,http://www.albright.edu/accelerated/masters-degree-articulations.html
Carnegie Mellon University,Master of Computational Data Science (MCDS),M,F,T,US,PA,Pittsburgh,School of Computer Science,http://mcds.cs.cmu.edu/?q=node/6
Carnegie Mellon University,MBA: Business Analytics Track,M,T,F,US,PA,Pittsburgh,Tepper School of Business,http://tepper.cmu.edu/prospective-students/masters/mba/curriculum/tracks-and-capstones/business-analytics
Carnegie Mellon University,"Master of Information Systems Management, Business Intelligence and Data Analytics (MISM-BIDA)",M,F,T,US,PA,Pittsburgh,Heinz College,http://www.heinz.cmu.edu/school-of-information-systems-and-management/information-technology-msit/curriculum/msit-bida/index.aspx
Carnegie Mellon University,"Master of Science in Information Technology, Business Intelligence and Data Analytics (MSIT-BIDA)",M,F,T,US,PA,Pittsburgh,Heinz College,http://www.heinz.cmu.edu/school-of-information-systems-and-management/information-technology-msit/curriculum/msit-bida/index.aspx
Carnegie Mellon University,Machine Learning,D,F,T,US,PA,Pittsburgh,,http://www.ml.cmu.edu/prospective-students/PhD%20Programs.html
Carnegie Mellon University,Master of Statistical Practice,M,F,T,US,PA,Pittsburgh,Statistics,http://www.stat.cmu.edu/academics/graduate/the-masters-in-statistical-practice-program
Drexel University,Information Studies,D,F,T,US,PA,Philadelphia,Computing and Informatics,http://drexel.edu/cci/academics/graduate-programs/phd-information-studies/
Drexel University,Certificate in Healthcare Informatics,C,F,T,US,PA,Philadelphia,Drexel University's Institute for Healthcare Informatics,http://drexel.edu/cci/programs/professional-development-programs/certificate-in-healthcare-informatics/
Drexel University,Online Master's in Health Informatics,M,T,F,US,PA,Philadelphia,College of Computing and Informatics with support from Drexel University's,http://www.drexel.com/online-degrees/information-sciences-degrees/ms-hci/index.aspx
Drexel University,M.S. in Business Analytics,M,F,T,US,PA,Philadelphia,LeBow College of Business,http://www.lebow.drexel.edu/academics/programs/masters/business-analytics
Harrisburg University of Science and Technology,Online Master of Science in Analytics,M,T,T,US,PA,Harrisburg,Graduate Education,http://www.harrisburgu.edu/academics/graduate/analytics/online-analytics.php
La Salle University,M.S. in Analytics,M,F,T,US,PA,Philadelphia,College of Professional & Continuing Studies,http://www.lasalle.edu/analytics/
Misericordia University,Health Care Informatics Graduate Certificate,C,T,T,US,PA,Dallas,College of Health Sciences,http://www.misericordia.edu/misericordia_pg_sub.cfm?sub_page_id=3990&subcat_id=108&page_id=989
Misericordia University,Health Informatics Master's Program,M,T,F,US,PA,Dallas,College of Health Sciences,http://www.misericordia.edu/misericordia_pg_sub.cfm?sub_page_id=4235&subcat_id=108
Lehigh University,Data Science Minor,B,F,T,US,PA,Bethlehem,Computer Science and Engineering,https://engineering.lehigh.edu/academics/undergraduate/minors/data-science-minor
Pennsylvania State University,Data Sciences,B,F,T,US,PA,University Park,Interdisciplinary: Statistics/Computer Sciences/Information Science & Tech,http://datasciences.psu.edu/
Pennsylvania State University,Social Data Analytics,D,F,T,US,PA,University Park,Interdisciplinary,http://bdss.psu.edu/education
Pennsylvania State University,Graduate Certificate in Applied Statistics,C,F,T,US,PA,University Park,Eberly College of Science,http://www.worldcampus.psu.edu/degrees-and-certificates/applied-statistics-certificate/courses
Pennsylvania State University,Master of Applied Statistics,M,T,F,US,PA,University Park,Eberly College of Science,http://www.worldcampus.psu.edu/degrees-and-certificates/applied-statistics-masters/overview
Pennsylvania State University,Graduate Certificate in Business Analytics,C,T,F,US,PA,University Park,Smeal College of Business,http://www.worldcampus.psu.edu/degrees-and-certificates/business-analytics-certificate/overview
Pennsylvania State University,Master of Professional Studies in Data Analytics,M,F,T,US,PA,University Park,Penn State World Campus,http://www.worldcampus.psu.edu/degrees-and-certificates/data-analytics-base/overview
Pennsylvania State University,Master of Professional Studies in Data Analytics,M,F,T,US,PA,University Park,Penn State World Campus,http://www.worldcampus.psu.edu/degrees-and-certificates/data-analytics-business/overview
Pennsylvania State University,Graduate Certificate in Business Analytics,C,F,T,US,PA,University Park,Penn State World Campus,https://www.worldcampus.psu.edu/degrees-and-certificates/business-analytics-certificate/overview
Philadelphia University,"M.S. in Modeling, Simulation and Data Analytics",M,F,T,US,PA,Philadelphia,"Kanbar College of Design, Engineering, and Commerce",http://www.philau.edu/msda/curriculum.html
Saint Joseph's University,Online Master of Science in Business Intelligence & Analytics,M,T,F,US,PA,Philadelphia,Erivan K. Haub School of Business,http://online.sju.edu/programs/business-intelligence-course.asp
Saint Joseph's University,Online Master's in Health Administration: Informatics Specialization,M,F,T,US,PA,Philadelphia,St Joseph's University Online,http://online.sju.edu/programs/masters-health-administration-informatics.asp
Saint Joseph's University,Master of Science in Business Intelligence & Analytics Program,M,T,F,US,PA,Philadelphia,Erivan K. Haub School of Business,http://www.sju.edu/int/academics/hsb/grad/msbi/
Temple University,Master of Science in Health Informatics,M,T,F,US,PA,Philadelphia,Health Information Management Department (College of Health Professions) an,http://chpsw.temple.edu/him/degrees-offered/master-science-health-informatics
University of Pittsburgh-Bradford,Master's Degree in Biomedical Informatics,M,T,F,US,PA,Bradford,Department of Biomedical Informatics,http://www.dbmi.pitt.edu/training-programs
University of Pittsburgh-Bradford,Master's Degree in Biostatistics,M,F,F,US,PA,Bradford,Graduate School of Public Health,http://www.publichealth.pitt.edu/Portals/0/BIOSTAT/BIOST%20MS%20Brochure.pdf
University of Pittsburgh-Pittsburgh Campus,MSIS - Big Data Analytics,M,T,T,US,PA,Pittsburgh,School of Information Sciences,http://www.ischool.pitt.edu/ist/degrees/specializations/big-data.php
Villanova University,Graduate Certificate in Applied Statistics,C,F,T,US,PA,Villanova,Liberal Arts and Sciences,http://www1.villanova.edu/content/dam/villanova/artsci/gradstudies/AppliedStatisticsGraduateInformationSheet.pdf
Villanova University,Master of Science in Applied Statistics,M,F,T,US,PA,Villanova,Liberal Arts and Sciences,http://www1.villanova.edu/villanova/artsci/mathematics/academic-programs/graduate/programs/msapplied.html
